{
  "id": "BR_P06_RW_D_LOD_ROUNDTRIP_V1",
  "workload_id": "RW-D_LOD_ROUNDTRIP",
  "workload_version": "1",
  "subject_id": "P0.6",
  "subject_version": "f7732f735707b96a5231e9dd1ca2d83d6f8affa7",
  "version_bundle": {"build": "f7732f735707b96a5231e9dd1ca2d83d6f8affa7","schema": 2,"model": "proof-a-model-v1","configuration": "proof-a-config-v1","benchmark_workload": "1"},
  "execution_mode": "release",
  "environment": {"hardware_class": "github-hosted-ubuntu-x64-reference-ci","os": "Ubuntu 24.04.4 LTS","runtime": ".NET 8.0.29","processor_count": 4,"architecture": "X64"},
  "seed_ids": [42,43,44,45],
  "workload_parameters": {"iterations": 500,"fixture": "proof-a-kernel-v1"},
  "duration": {"iterations": 500},
  "instrumentation_overhead": "Stopwatch timing plus runtime allocation/process memory counters; paired paths are used where overhead is compared.",
  "repetitions": 3,
  "metrics": {"materialize_latency": 0.006175733333333333,"aggregate_latency": 0.0680622,"state_bytes": 9469,"identity_mismatch_count": 0,"conservation_mismatch_count": 0,"information_mismatch_count": 0},
  "budget_status_before": "UNMEASURED_BLOCKER",
  "budget_status_after": "MEASURED",
  "interpretation": "Micro/aggregate/materialize preserves stable IDs, conserved resource, rare-tail identity, and pending-process references.",
  "timestamp": "2026-08-16T11:36:25.8353842+00:00",
  "target_hardware_class": "github-hosted-ubuntu-x64-reference-ci",
  "safety_margin_rationale": "This runner class is a reproducible CI reference baseline only; no product-scale capacity is inferred.",
  "regression_threshold": "Investigate a same-workload mean regression above 25%; do not auto-fail before an accepted baseline history exists."
}
